{
  "$schema": "https://json-schema.org/draft/2020-12/schema",
  "$id": "https://example.invalid/job-application-workflow/matching-v2.schema.json",
  "title": "Matching record schema v2",
  "type": "object",
  "required": ["schema_version", "company", "date", "scope", "coverage", "raw_catalog", "catalog_index", "positions"],
  "properties": {
    "schema_version": {"const": 2},
    "company": {"type": "string", "minLength": 1},
    "date": {"type": "string", "minLength": 1},
    "scope": {"type": "string", "minLength": 1},
    "coverage": {"$ref": "#/$defs/coverage"},
    "raw_catalog": {"$ref": "#/$defs/rawCatalog"},
    "catalog_index": {
      "type": "array",
      "items": {"$ref": "#/$defs/catalogEntry"}
    },
    "positions": {
      "type": "array",
      "items": {"$ref": "#/$defs/position"}
    }
  },
  "$defs": {
    "coverage": {
      "type": "object",
      "required": ["capture_status", "official_total", "last_page_reached", "human_attested"],
      "properties": {
        "capture_status": {"enum": ["complete", "partial", "unknown"]},
        "official_total": {"type": "integer", "minimum": 0},
        "last_page_reached": {"type": "boolean"},
        "human_attested": {"type": "boolean"}
      },
      "additionalProperties": true
    },
    "rawCatalog": {
      "type": "object",
      "required": ["file", "format", "total_positions"],
      "properties": {
        "file": {"type": "string", "minLength": 1},
        "format": {"enum": ["json", "csv", "tsv"]},
        "records_path": {"type": "string"},
        "id_path": {"type": "string"},
        "id_column": {"type": "string", "minLength": 1},
        "delimiter": {"type": "string", "minLength": 1, "maxLength": 1},
        "encoding": {"type": "string"},
        "total_positions": {"type": "integer", "minimum": 0}
      },
      "additionalProperties": true
    },
    "catalogEntry": {
      "type": "object",
      "required": ["id", "title", "in_scope"],
      "properties": {
        "id": {"type": ["string", "integer"], "not": {"type": "boolean"}},
        "title": {"type": "string", "minLength": 1},
        "city": {"type": "string"},
        "url": {"type": "string"},
        "in_scope": {"type": "boolean"},
        "exclusion": {"type": "string"}
      },
      "additionalProperties": true
    },
    "sourceQuote": {
      "type": "object",
      "required": ["id", "text"],
      "properties": {
        "id": {"type": "string", "minLength": 1},
        "text": {"type": "string", "minLength": 1},
        "locator": {
          "type": "object",
          "required": ["line_start"],
          "properties": {
            "line_start": {"type": "integer", "minimum": 1},
            "line_end": {"type": "integer", "minimum": 1}
          },
          "additionalProperties": true
        }
      },
      "additionalProperties": true
    },
    "jdSource": {
      "type": "object",
      "required": ["position_id", "url", "read_at", "snapshot_file", "quotes"],
      "properties": {
        "position_id": {"type": ["string", "integer"], "not": {"type": "boolean"}},
        "url": {"type": "string", "minLength": 1},
        "read_at": {"type": "string", "minLength": 1},
        "snapshot_file": {"type": "string", "minLength": 1},
        "sha256": {"type": "string", "pattern": "^[0-9a-fA-F]{64}$"},
        "quotes": {"type": "array", "minItems": 1, "items": {"$ref": "#/$defs/sourceQuote"}}
      },
      "additionalProperties": true
    },
    "candidateSource": {
      "type": "object",
      "required": ["profile_version", "snapshot_file", "evidence"],
      "properties": {
        "profile_version": {"type": "string", "minLength": 1},
        "snapshot_file": {"type": "string", "minLength": 1},
        "sha256": {"type": "string", "pattern": "^[0-9a-fA-F]{64}$"},
        "evidence": {"type": "array", "items": {"$ref": "#/$defs/sourceQuote"}}
      },
      "additionalProperties": true
    },
    "requirement": {
      "type": "object",
      "required": ["requirement_id", "text", "category", "category_basis_quote_ids", "jd_quote_ids", "candidate_evidence_ids", "support", "conclusion", "judgment"],
      "properties": {
        "requirement_id": {"type": "string", "minLength": 1},
        "text": {"type": "string", "minLength": 1},
        "category": {"enum": ["hard_qualification", "core_capability", "plus", "ambiguous"]},
        "category_basis_quote_ids": {"type": "array", "minItems": 1, "items": {"type": "string", "minLength": 1}},
        "jd_quote_ids": {"type": "array", "minItems": 1, "items": {"type": "string", "minLength": 1}},
        "candidate_evidence_ids": {"type": "array", "items": {"type": "string", "minLength": 1}},
        "support": {"enum": ["direct_support", "transferable", "no_evidence", "conflict"]},
        "conclusion": {"enum": ["satisfied", "not_satisfied", "pending"]},
        "judgment": {"type": "string", "minLength": 1}
      },
      "additionalProperties": true
    },
    "decision": {
      "type": "object",
      "required": ["state", "basis", "reason"],
      "properties": {
        "state": {"enum": ["recommended", "consider", "pending", "excluded", "not_applicable"]},
        "basis": {"const": "requirement_summary"},
        "reason": {"type": "string", "minLength": 1}
      },
      "additionalProperties": true
    },
    "requirementSummary": {
      "type": "object",
      "required": ["requirements_total", "hard_qualification", "core_capability", "plus", "ambiguous", "core_total", "direct_support", "transferable", "no_evidence", "conflict", "satisfied", "not_satisfied", "pending"],
      "additionalProperties": {"type": "integer", "minimum": 0}
    },
    "position": {
      "type": "object",
      "required": ["id", "title", "city", "jd_source", "candidate_source", "requirements", "requirement_summary", "decision"],
      "properties": {
        "id": {"type": ["string", "integer"], "not": {"type": "boolean"}},
        "title": {"type": "string", "minLength": 1},
        "city": {"type": "string"},
        "url": {"type": "string"},
        "excluded": {"type": "boolean"},
        "exclusion_reason": {"type": "string"},
        "jd_source": {"$ref": "#/$defs/jdSource"},
        "candidate_source": {"$ref": "#/$defs/candidateSource"},
        "requirements": {"type": "array", "minItems": 1, "items": {"$ref": "#/$defs/requirement"}},
        "requirement_summary": {"$ref": "#/$defs/requirementSummary"},
        "decision": {"$ref": "#/$defs/decision"},
        "grade": {"enum": ["S", "A", "B", "C"]}
      },
      "additionalProperties": true
    }
  },
  "additionalProperties": true
}
